{
  "schema_version": "1.0",
  "data_classification": "non_live_contract_fixture",
  "mode": "unavailable",
  "status": "unavailable",
  "disclosure": "Research is currently unavailable.",
  "production_eligible": false,
  "live_claims": {
    "merchants": false,
    "prices": false,
    "availability": false,
    "coverage": false,
    "refreshed_research": false
  },
  "evidence_ids": []
}
