{
  "schema_version": "1.0",
  "data_classification": "non_live_contract_fixture",
  "mode": "mock",
  "status": "completed",
  "disclosure": "Demo research — not live marketplace data.",
  "production_eligible": false,
  "live_claims": {
    "merchants": false,
    "prices": false,
    "availability": false,
    "coverage": false,
    "refreshed_research": false
  },
  "evidence_ids": ["mock-contract-evidence-1"]
}
